<?xml version="1.0" encoding="UTF-8"?>
<!DOCTYPE biblioteca [
	<!ELEMENT biblioteca (libros, revistas, periodicos)> 
	<!ELEMENT libros (libro+)>
	<!ELEMENT libro (titulo, capitulos, indice, sinopsis)> 
			       <!ELEMENT titulo (#PCDATA)>
			       <!ELEMENT indice (#PCDATA)>
			       <!ELEMENT sinopsis (#PCDATA)>
	<!ELEMENT capitulos (capitulo+)> 
	<!ELEMENT capitulo (titulo, contenido)> 
	
	
	
	<!ELEMENT revistas (revista+)> 
	<!ELEMENT revista (titulo, numerorevista, indice, secciones)> 
			      
			       <!ELEMENT numerovista (#PCDATA)>
			     
	<!ELEMENT secciones (seccion+)> 
	<!ELEMENT seccion (contenido)> 
			 <!ELEMENT contenido (#PCDATA)>
	
	
	
	<!ELEMENT periodicos (periodico+)> 
	<!ELEMENT periodico (secciones , indice)>
	<!ELEMENT secciones (seccion+)> 
	<!ELEMENT seccion (articulos+)> 
	<!ELEMENT articulos (articulo+)> 
	<!ELEMENT articulo (contenido)> 
	
		   
	<!ATTLIST libro numpaginas CDATA #REQUIRED > 
	<!ATTLIST libro tipo_clase (novela|infantil|didactico) #REQUIRED > 
	<!ATTLIST libro id ID #REQUIRED> 			
    <!ATTLIST capitulo numpaginas CDATA #REQUIRED> 
    
	<!ATTLIST revista numpaginas CDATA #REQUIRED> 
    <!ATTLIST revista tipo_clase (informatica|corazon|coches|investigacion) #REQUIRED> 
    <!ATTLIST revista id ID #REQUIRED> 
    <!ATTLIST seccion numpaginas CDATA #REQUIRED> 
	<!ATTLIST contenido enlace CDATA #REQUIRED> 
	
	
    <!ATTLIST periodicos fechapublicacion CDATA #REQUIRED > 	
    <!ATTLIST periodicos tipo_clase (nacionales|internacionales) #REQUIRED > 	
    <!ATTLIST periodicos id ID #REQUIRED> 	
    <!ATTLIST seccion tipo_seccion  (economica|opinion|deportes|nacional|internacional)  #REQUIRED> 	
    <!ATTLIST articulo autor CDATA #REQUIRED> 	
    <!ATTLIST contenido enlace CDATA #REQUIRED > 	
]>